{
  "schema_version": "1.0.0",
  "payment_id": "pi_3MtweELkdIwHu7ix0Dt0gF2H",
  "customer_id": "cus_NffrFeUfNV2Hib",
  "invoice_id": "in_1MtHbELkdIwHu7ixl4OzzPMv",
  "amount": {
    "amount": 15000,
    "currency": "usd"
  },
  "amount_received": {
    "amount": 15000,
    "currency": "usd"
  },
  "currency": "usd",
  "status": "succeeded",
  "description": "Payment for Invoice ACME-0001",
  "payment_method_type": "card",
  "receipt_email": "john.smith@example.com",
  "statement_descriptor": "ACME CORP INV-0001",
  "latest_charge_id": "ch_3MtweELkdIwHu7ix0abc123",
  "error": null,
  "event_time": "2024-03-02T00:00:00.000Z",
  "canceled_at": null,
  "external_metadata": {
    "order_id": "ORD-12345"
  },
  "meta": {
    "created_at": "2024-03-02T00:00:00.000Z",
    "source": {
      "platform": "stripe",
      "platform_version": "v1"
    }
  }
}
